{
 "arms": {
  "a": {
   "arm": "shadow:deepseek-backfill",
   "model": "deepseek/deepseek-v4-pro",
   "provider": "deepseek",
   "rubrics_sha": "4ba876efaa230b44970ce5084f1a6c461a26f46e",
   "run_id": "r-20260613T042139Z-51-attribution-21ff28",
   "verdict": "approve"
  },
  "b": {
   "arm": "shadow:grok-backfill",
   "model": "x-ai/grok-4.3",
   "provider": "grok",
   "rubrics_sha": "dd768d6a9f04a9f5d64c4930c172fd7ebccf763d",
   "run_id": "r-20260613T050724Z-51-attribution-912da1",
   "verdict": "approve"
  }
 },
 "created_by": "pair-maker-v1",
 "diff_blob": "432b0f37fe35e3d466757dbcec56ce8ae238ddaafb90b225bcd51d40b6731f36",
 "head_sha": "4284df3a644fb2885e56bd7f9fb7f5218d075999",
 "pair_id": "8dc39437ead23bbd",
 "pr": 51,
 "prompt_policy": "fresh",
 "rubric": "attribution",
 "schema": "tauceti.pair/v1"
}
