{
 "arms": {
  "a": {
   "arm": "shadow:deepseek-backfill",
   "model": "deepseek/deepseek-v4-pro",
   "provider": "deepseek",
   "rubrics_sha": "59403d5471ff29d54e2a2781005539703a08567a",
   "run_id": "r-20260613T033039Z-40-deprecation-a368a7",
   "verdict": "approve"
  },
  "b": {
   "arm": "shadow:sonnet-backfill",
   "model": "claude-sonnet-4-6",
   "provider": "sonnet",
   "rubrics_sha": "dd768d6a9f04a9f5d64c4930c172fd7ebccf763d",
   "run_id": "r-20260613T044300Z-40-deprecation-aba83c",
   "verdict": "request_changes"
  }
 },
 "created_by": "pair-maker-v1",
 "diff_blob": "0d62834398723710bc478de32cceb477f52ab36dd222332fc1f5576fd1eb48df",
 "head_sha": "9cfaae886bccbffe9a74e55be28fb687e278e635",
 "pair_id": "83427048d51ce332",
 "pr": 40,
 "prompt_policy": "fresh",
 "rubric": "deprecation",
 "schema": "tauceti.pair/v1"
}
